{
  "$schema": "https://json-schema.org/draft/2020-12/schema",
  "$id": "https://saccade.local/contracts/frozen_source_supersession_ledger_v1.schema.json",
  "title": "Frozen-source supersession ledger v1",
  "description": "Append-only record of frozen inputs of CLOSED research packets whose HEAD bytes have legitimately moved on. One entry per (path, frozen_sha256). The packet itself is never edited; the entry records where the frozen bytes still live and whether any research claim inherits across the change. Policy: docs/decisions/026-frozen-input-source-evolution.md.",
  "type": "object",
  "additionalProperties": false,
  "required": ["schema", "policy", "entries"],
  "properties": {
    "schema": { "const": "frozen_source_supersession_ledger_v1" },
    "policy": { "const": "docs/decisions/026-frozen-input-source-evolution.md" },
    "purpose": { "type": "string" },
    "entries": {
      "type": "array",
      "items": { "$ref": "#/$defs/entry" }
    }
  },
  "$defs": {
    "sha256": { "type": "string", "pattern": "^[0-9a-f]{64}$" },
    "commit": { "type": "string", "pattern": "^[0-9a-f]{40}$" },
    "date": { "type": "string", "pattern": "^[0-9]{4}-[0-9]{2}-[0-9]{2}$" },
    "packet_id": { "type": "string", "pattern": "^[A-Za-z0-9][A-Za-z0-9._-]*$" },
    "binding_ref": {
      "type": "object",
      "additionalProperties": false,
      "required": ["packet_id", "binding"],
      "properties": {
        "packet_id": { "$ref": "#/$defs/packet_id" },
        "binding": {
          "type": "string",
          "description": "`inputs:<role>` for a frozen_input_identities.json row, `tooling:<key>` for a manifest.json tooling row.",
          "pattern": "^(inputs|tooling):[A-Za-z0-9_.-]+$"
        }
      }
    },
    "owner_authorization": {
      "type": "object",
      "additionalProperties": false,
      "required": ["owner_acceptance_id", "date"],
      "properties": {
        "owner_acceptance_id": { "type": "string", "minLength": 1 },
        "date": { "$ref": "#/$defs/date" }
      }
    },
    "entry": {
      "type": "object",
      "additionalProperties": false,
      "required": [
        "entry_id",
        "kind",
        "path",
        "frozen_sha256",
        "bound_by",
        "last_current_ref",
        "recorded_on",
        "recorded_by_pr",
        "rationale",
        "claims_inherited",
        "successor_packet_id",
        "owner_authorization"
      ],
      "properties": {
        "entry_id": { "type": "string", "pattern": "^[A-Za-z0-9][A-Za-z0-9._-]*$" },
        "kind": {
          "type": "string",
          "enum": ["historicization", "supersession"],
          "description": "historicization: production source evolves, no research claim inherits; the packet becomes historical for this path. supersession: a successor packet re-freezes the evolved bytes and claims a relation to the CLOSED terminal; owner authorization required."
        },
        "path": { "type": "string", "minLength": 1, "pattern": "^[^/].*[^/]$" },
        "frozen_sha256": { "$ref": "#/$defs/sha256" },
        "bound_by": {
          "type": "array",
          "minItems": 1,
          "items": { "$ref": "#/$defs/binding_ref" },
          "description": "Every packet binding that pins exactly (path, frozen_sha256). The checker recomputes this set and refuses an entry that lists more or fewer."
        },
        "last_current_ref": {
          "$ref": "#/$defs/commit",
          "description": "A commit (never a branch tip) at which `path` still hashed to frozen_sha256. Must be an ancestor of HEAD; the checker re-hashes the blob at this ref."
        },
        "recorded_on": { "$ref": "#/$defs/date" },
        "recorded_by_pr": { "type": "integer", "minimum": 1 },
        "rationale": { "type": "string", "minLength": 1 },
        "claims_inherited": {
          "type": "boolean",
          "description": "Always false for historicization. For supersession it is still false at ledger time: whether retained conclusions transfer to the new bytes is the successor packet's own claim to establish."
        },
        "successor_packet_id": {
          "oneOf": [{ "type": "null" }, { "$ref": "#/$defs/packet_id" }]
        },
        "owner_authorization": {
          "oneOf": [{ "type": "null" }, { "$ref": "#/$defs/owner_authorization" }]
        }
      }
    }
  }
}
